<?xml version="1.0" encoding="UTF-8"?>
<!DOCTYPE taxon PUBLIC "-//taxon//DTD taxon 1.0//EN" "file://e:\src\wml\etc\taxon10.dtd">
<taxon xml:ns="taxon">
  <sys name="Семейство" rank="1">
    Culicidae
  </sys>
  <sys name="Триба" rank="3">
    Aedini
  </sys>
  <sys name="Род" rank="4">
    Aedes
  </sys>
  <sys name="Подрод" rank="7">
    Aedes
  </sys>
  <sys name="Вид" rank="10">
    Aedes (Aedes) cinereus
  </sys>
  <authors>
    <person date="1818" rel="dsc-genus">
      <name>
        Meigen
      </name>
      <description>
        Описатель рода
      </description>
    </person>
    <person date="1818" rel="dsc-subgenus">
      <name>
        Meigen
      </name>
      <description>
        Описатель подрода
      </description>
    </person>
    <person date="1818" rel="dsc-species">
      <name>
        Meigen
      </name>
      <description>
        Описатель вида
      </description>
    </person>
  </authors>
  <date value="1818" ratio="1">
  </date>
  <synonyms>
    <name xml:lang="ru" option="Sakha">
      (rufus Gimmerthal, 1845, pseudoesoensis Yamaguti et Tamaboko, 1954)
    </name>
  </synonyms>
  <distributions>
    <distribution>
      <area>
        <description>
          Голаркт
        </description>
        <location xml:lang="ru">
          Голаркт
        </location>
      </area>
    </distribution>
    <distribution>
      <area name="Sakha">
        <location xml:lang="ru">
          ЗЯ:Нюрба, ЦЯ:Аллах, Еланское, Ерт, Кептин, Магарас, Мегино-Алдан, 
          Михайловка, Хаптагай, Якутск, ЮЗЯ: Токко, ЮЯ: Нерюнгри, Томмот, Чульман, 
          Ыллымах, Якокит
        </location>
      </area>
    </distribution>
    <distribution>
      <area name="Russia">
        <location xml:lang="ru">
          Сиб., ДВ, Чук., Маг., Камч., Хаб., Амур., Прим., Сах., Якут., Чит., 
          Бур., Иркут.
        </location>
      </area>
    </distribution>
    <distribution>
      <area name="Earth">
        <location xml:lang="ru">
          Умеренная полоса Евразии и С Америки - Европа, Канада, С США, СВ 
          Китай, Япония, Кавказ, Ср. Азия, Каз.,
        </location>
      </area>
    </distribution>
  </distributions>
</taxon>